{
  "$schema": "http://json-schema.org/draft-07/schema#",
  "title": "BusinessProblemDataset",
  "type": "array",
  "items": {
    "type": "object",
    "properties": {
      "id": { "type": "string" },
      "title": { "type": "string" },
      "industry": { "type": "string" },
      "region": { "type": "string" },
      "severity": { "type": "string", "enum": ["Low", "Medium", "High", "Critical"] },
      "impact_score": { "type": "number", "minimum": 0, "maximum": 100 },
      "description": { "type": "string" }
    },
    "required": ["id", "title", "industry", "region", "severity", "impact_score", "description"]
  }
}
